<?xml version="1.0" encoding="UTF-8"?>
<concesionario xmlns:xsi="http://www.w3.org/2001/XMLSchema-instance" xsi:noNamespaceSchemaLocation="concesionario.xsd" provincia="Malaga">
    <coche matricula="6732KPC">
        <marca>Seat</marca>
        <modelo>Ateca</modelo>
        <cilindrada>1.7</cilindrada>
        <combustible>Diesel</combustible>
        <precio>23.000€</precio>
        <año>2018</año>
        <color>negro</color>
        <interesado>33358697A</interesado>
        <interesado>33628697A</interesado>
        <accesorios></accesorios>
    </coche>
    <coche matricula="7777JRC">
        <marca>BMW</marca>
        <modelo>Serie 1</modelo>
        <cilindrada>2.0</cilindrada>
        <combustible>Diesel</combustible>
        <precio>35.000€</precio>
        <año>2021</año>
        <color>azul</color>
        <interesado>34858697A</interesado>
    </coche>
    <coche matricula="6732KPC">
        <marca>Renault</marca>
        <modelo>Megane</modelo>
        <caballos>120</caballos>
        <combustible>Diesel</combustible>
        <precio>7.000€</precio>
        <año>2018</año>
        <color>verde</color>
    </coche>
</concesionario>